[
  {
    "muscle_group_id": "mg_chest_sternal",
    "muscle_group": "chest",
    "muscle_subdivision": "sternal_pectoralis_major",
    "anatomical_function": "Horizontal adduction and shoulder flexion",
    "effective_exercises": "ex_barbell_bench_press|ex_cambered_barbell_bench_press|ex_dumbbell_bench_press|ex_machine_chest_press|ex_cable_fly",
    "minimum_effective_weekly_sets": 6,
    "typical_effective_weekly_sets_low": 10,
    "typical_effective_weekly_sets_high": 16,
    "higher_volume_range_low": 17,
    "higher_volume_range_high": 22,
    "likely_diminishing_returns_threshold": 20,
    "recommended_sets_per_session_low": 2,
    "recommended_sets_per_session_high": 8,
    "recommended_frequency_low": 1,
    "recommended_frequency_high": 3,
    "recommended_rep_range_low": 5,
    "recommended_rep_range_high": 20,
    "recommended_rir_low": 0,
    "recommended_rir_high": 4,
    "recommended_rest_seconds_low": 90,
    "recommended_rest_seconds_high": 240,
    "lengthened_position_considerations": "Include at least one pain-free exercise that challenges the muscle at a relatively long length when practical; evidence is muscle-specific and does not justify painful ROM.",
    "indirect_set_contribution": "Pressing contributes 1.0; close-grip or overhead pressing usually 0-0.5",
    "recovery_considerations": "Adjust from the starting range using standardized performance, soreness that affects training, joint tolerance, sleep, and session quality rather than soreness alone.",
    "cutting_adjustment": "Begin by retaining recent productive volume; reduce low-value sets 10-30% only if recovery or performance repeatedly deteriorates.",
    "recomp_adjustment": "Use maintenance-to-moderate productive volume and prioritize repeatable progression.",
    "maintenance_adjustment": "Operational estimate: approximately 25-50% of recent productive volume with retained effort/load exposure.",
    "bulking_adjustment": "Add sets only after calories, technique, exercise selection, and recovery are adequate and performance has plateaued.",
    "maintenance_volume_estimate": 4,
    "training_status": "intermediate",
    "evidence_strength": "low",
    "confidence_rating": "low",
    "supporting_study_ids": "stu_0001|stu_0002|stu_0003|stu_0025|stu_0027",
    "notes": "Set numbers are conservative operational starting ranges inferred from general dose-response evidence, not validated muscle-specific biological thresholds. Count hard working sets near the target RIR; exclude warm-ups."
  },
  {
    "muscle_group_id": "mg_chest_clavicular",
    "muscle_group": "chest",
    "muscle_subdivision": "clavicular_pectoralis_major",
    "anatomical_function": "Shoulder flexion and horizontal adduction",
    "effective_exercises": "ex_incline_dumbbell_press|ex_incline_machine_press|ex_low_to_high_cable_fly",
    "minimum_effective_weekly_sets": 4,
    "typical_effective_weekly_sets_low": 8,
    "typical_effective_weekly_sets_high": 14,
    "higher_volume_range_low": 15,
    "higher_volume_range_high": 20,
    "likely_diminishing_returns_threshold": 18,
    "recommended_sets_per_session_low": 2,
    "recommended_sets_per_session_high": 7,
    "recommended_frequency_low": 1,
    "recommended_frequency_high": 3,
    "recommended_rep_range_low": 6,
    "recommended_rep_range_high": 20,
    "recommended_rir_low": 0,
    "recommended_rir_high": 4,
    "recommended_rest_seconds_low": 90,
    "recommended_rest_seconds_high": 240,
    "lengthened_position_considerations": "Include at least one pain-free exercise that challenges the muscle at a relatively long length when practical; evidence is muscle-specific and does not justify painful ROM.",
    "indirect_set_contribution": "Flat pressing 0.5; overhead pressing 0-0.25",
    "recovery_considerations": "Adjust from the starting range using standardized performance, soreness that affects training, joint tolerance, sleep, and session quality rather than soreness alone.",
    "cutting_adjustment": "Begin by retaining recent productive volume; reduce low-value sets 10-30% only if recovery or performance repeatedly deteriorates.",
    "recomp_adjustment": "Use maintenance-to-moderate productive volume and prioritize repeatable progression.",
    "maintenance_adjustment": "Operational estimate: approximately 25-50% of recent productive volume with retained effort/load exposure.",
    "bulking_adjustment": "Add sets only after calories, technique, exercise selection, and recovery are adequate and performance has plateaued.",
    "maintenance_volume_estimate": 3,
    "training_status": "intermediate",
    "evidence_strength": "low",
    "confidence_rating": "low",
    "supporting_study_ids": "stu_0001|stu_0002|stu_0003|stu_0025|stu_0027",
    "notes": "Set numbers are conservative operational starting ranges inferred from general dose-response evidence, not validated muscle-specific biological thresholds. Count hard working sets near the target RIR; exclude warm-ups."
  },
  {
    "muscle_group_id": "mg_upper_back",
    "muscle_group": "upper_back",
    "muscle_subdivision": "rhomboids_and_mid_trapezius",
    "anatomical_function": "Scapular retraction and control",
    "effective_exercises": "ex_chest_supported_row|ex_seated_cable_row|ex_reverse_pec_deck",
    "minimum_effective_weekly_sets": 6,
    "typical_effective_weekly_sets_low": 10,
    "typical_effective_weekly_sets_high": 18,
    "higher_volume_range_low": 18,
    "higher_volume_range_high": 24,
    "likely_diminishing_returns_threshold": 22,
    "recommended_sets_per_session_low": 2,
    "recommended_sets_per_session_high": 8,
    "recommended_frequency_low": 1,
    "recommended_frequency_high": 4,
    "recommended_rep_range_low": 6,
    "recommended_rep_range_high": 20,
    "recommended_rir_low": 0,
    "recommended_rir_high": 4,
    "recommended_rest_seconds_low": 90,
    "recommended_rest_seconds_high": 240,
    "lengthened_position_considerations": "Include at least one pain-free exercise that challenges the muscle at a relatively long length when practical; evidence is muscle-specific and does not justify painful ROM.",
    "indirect_set_contribution": "Rows 1.0; vertical pulls 0.25-0.5",
    "recovery_considerations": "Adjust from the starting range using standardized performance, soreness that affects training, joint tolerance, sleep, and session quality rather than soreness alone.",
    "cutting_adjustment": "Begin by retaining recent productive volume; reduce low-value sets 10-30% only if recovery or performance repeatedly deteriorates.",
    "recomp_adjustment": "Use maintenance-to-moderate productive volume and prioritize repeatable progression.",
    "maintenance_adjustment": "Operational estimate: approximately 25-50% of recent productive volume with retained effort/load exposure.",
    "bulking_adjustment": "Add sets only after calories, technique, exercise selection, and recovery are adequate and performance has plateaued.",
    "maintenance_volume_estimate": 4,
    "training_status": "intermediate",
    "evidence_strength": "low",
    "confidence_rating": "low",
    "supporting_study_ids": "stu_0001|stu_0002|stu_0003|stu_0025|stu_0027",
    "notes": "Set numbers are conservative operational starting ranges inferred from general dose-response evidence, not validated muscle-specific biological thresholds. Count hard working sets near the target RIR; exclude warm-ups."
  },
  {
    "muscle_group_id": "mg_lats",
    "muscle_group": "lats",
    "muscle_subdivision": "latissimus_dorsi",
    "anatomical_function": "Shoulder extension and adduction",
    "effective_exercises": "ex_pull_up|ex_lat_pulldown|ex_one_arm_cable_pulldown|ex_dumbbell_row",
    "minimum_effective_weekly_sets": 6,
    "typical_effective_weekly_sets_low": 10,
    "typical_effective_weekly_sets_high": 18,
    "higher_volume_range_low": 18,
    "higher_volume_range_high": 24,
    "likely_diminishing_returns_threshold": 22,
    "recommended_sets_per_session_low": 2,
    "recommended_sets_per_session_high": 8,
    "recommended_frequency_low": 1,
    "recommended_frequency_high": 4,
    "recommended_rep_range_low": 6,
    "recommended_rep_range_high": 20,
    "recommended_rir_low": 0,
    "recommended_rir_high": 4,
    "recommended_rest_seconds_low": 90,
    "recommended_rest_seconds_high": 240,
    "lengthened_position_considerations": "Include at least one pain-free exercise that challenges the muscle at a relatively long length when practical; evidence is muscle-specific and does not justify painful ROM.",
    "indirect_set_contribution": "Vertical pulls and shoulder-extension rows 1.0; other rows 0.5",
    "recovery_considerations": "Adjust from the starting range using standardized performance, soreness that affects training, joint tolerance, sleep, and session quality rather than soreness alone.",
    "cutting_adjustment": "Begin by retaining recent productive volume; reduce low-value sets 10-30% only if recovery or performance repeatedly deteriorates.",
    "recomp_adjustment": "Use maintenance-to-moderate productive volume and prioritize repeatable progression.",
    "maintenance_adjustment": "Operational estimate: approximately 25-50% of recent productive volume with retained effort/load exposure.",
    "bulking_adjustment": "Add sets only after calories, technique, exercise selection, and recovery are adequate and performance has plateaued.",
    "maintenance_volume_estimate": 4,
    "training_status": "intermediate",
    "evidence_strength": "low",
    "confidence_rating": "low",
    "supporting_study_ids": "stu_0001|stu_0002|stu_0003|stu_0025|stu_0027",
    "notes": "Set numbers are conservative operational starting ranges inferred from general dose-response evidence, not validated muscle-specific biological thresholds. Count hard working sets near the target RIR; exclude warm-ups."
  },
  {
    "muscle_group_id": "mg_traps_upper",
    "muscle_group": "traps",
    "muscle_subdivision": "upper_trapezius",